Date,text
2018-06-03,"Stopped at the very first tweet:

&gt; A Lightning ""token"" is an alt coin pegged to (and, theoretically, backed by) BTC.

There are no Lightning ""tokens."" LN works by updating an unsigned Bitcoin transaction.

I'm all for healthy debate. But this stuff is just nonsense."
2018-06-03,[Made this for Bitcoin](https://youtu.be/oDcNkggCXRQ)
2018-06-03,"SPV wallets allow for verifying received transactions, and allow users to manage their own private keys. BCH works like BTC used to."
2018-06-03,"Whilst I agree with the sentiment of much that you've written on a personal level, I don't worry about other people investing in bitcoin 'for the wrong reasons'. Its not really for me to say how others should invest their money - and I suspect that the more they learn about it, the more they'll recognise why its a huge improvement on the current model. I don't think its a bad strategy to sell 10% of your remaining holdings either, every time it goes up x10 or whichever multiplier you choose. 

But I think its also crucial that if you are a true believer you should use bitcoin as it was intended, and spend them wherever they're accepted. The ecosystem needs users more than it needs hodlers. Least that's my take on it. "
2018-06-03,"Of course you can lose cash in your wallet or if you keep your life savings under your mattress and your house burns down. But the point I'm trying to make is that bitcoin is going to be too technologically complex for most people to grasp. Furthermore, people are going to trust it far more than they should. "
2018-06-03,"Text of the tweet:

&gt; **Paul Wasensteiner ‏@PWasensteiner**

&gt; 1. Those that have tried to 'fix' #Bitcoin by changing it to something else entirely have done so because they do not understand the *invisible hand*. They feel it should be their hand there instead.

&gt; 2. This is why we have BTC thought leaders telling people that 'their node gives them power over the network' and that 'miners are evil'. They simply do not understand the incentives of the system i.e. the invisible hand.

&gt; 3. Network participants are all incentivised to *naturally* do what benefits themselves and the system. I.e. #Bitcoin aligns the incentives of the system with the participant.

&gt; 4. The strength of the alignment is a function of the amount of skin the game.

&gt; 5. Miners have an amount of skin in the game ∝ (proportional) to their fixed cost investment.  
Businesses that have integrated Bitcoin have skin in the game, ∝ to their reliance on it.   
Individuals that hold bitcoin have skin in the game ∝ to their holdings.

&gt; 6. Exchanges have skin in the game ∝ the amount of income they derive from trading pairs of that specific cryptocurrency.

&gt; 7. Non-mining nodes have no skin in the game. You can spin up 10,000 nodes right now and say you are the majority of the nodes in the network. A node does not require you to hold any Bitcoin.

&gt; 8. Developers do not *necessarily* have any skin in the game. In fact, their motives and interests are often entirely unclear.

&gt; 9. Should *all* miners decide to fork:   
Exchanges can decide they will not list the fork, businesses can decide to stop using it, investors can sell it (before the fork), a non-mining node can do nothing. I.e. all you can do is remove your skin from the game to hurt miner profits.

&gt; 10. Should *some* miner decide to fork:  
Exchanges decide how they want to list each side of fork. Businesses can decide to use one fork or the other. A non-mining node can upgrade or do nothing but has no effect on outcome. I.e. participants can place skin on each side of fork.

&gt; 11. What does this all mean? Well, it is actually quite profound. #Bitcoin creates an invisible hand that aligns participant's self-interest with the network proportional to their skin in the game and incentivises people to put more skin in the game.

&gt; 12. What this means is, that adoption and decentralisation are inextricably linked. The more adoption there is, the more people have skin in the game and the more decentralisation there is.

&gt; 13.  In a world of hyperbitcoinization, when every lawyer, judge, politician, business person, engineer, designer, builder, business, government, organisation, community, have skin in the game, every person on the planet will be aligned to securing and improving the network."
2018-06-03,"Ooooh shit boys.

Iv watched day trading videos all weekend - as i want to profit from this bear market. Im gonna go lose meself a whole lotta bitcoin.

Wish me luck"
2018-06-03,"Your submission has been flagged for removal because it is considered off topic for the Bitcoin subreddit.

^^I ^^am ^^a ^^bot ^^and ^^cannot ^^respond. ^^Please ^^contact ^^/r/Bitcoin ^^moderators [^^directly ^^via ^^mod ^^mail](https://www.reddit.com/message/compose?to=%2Fr%2FBitcoin) ^^if ^^you ^^have ^^questions."
2018-06-03,"Your submission has been flagged for removal because it is considered off topic for the Bitcoin subreddit.

^^I ^^am ^^a ^^bot ^^and ^^cannot ^^respond. ^^Please ^^contact ^^/r/Bitcoin ^^moderators [^^directly ^^via ^^mod ^^mail](https://www.reddit.com/message/compose?to=%2Fr%2FBitcoin) ^^if ^^you ^^have ^^questions."
2018-06-03,"This topic has been submitted several times. Please check the front page of /r/Bitcoin for previous submissions, as well as /r/Bitcoin/new. You can also try using the search bar. Thank you.

^^I ^^am ^^a ^^bot ^^and ^^cannot ^^respond. ^^Please ^^contact ^^/r/Bitcoin ^^moderators [^^directly ^^via ^^mod ^^mail](https://www.reddit.com/message/compose?to=%2Fr%2FBitcoin) ^^if ^^you ^^have ^^questions."
2018-06-03,"&gt; People don't have the same confidence that their money will always function as they expected it to when the acquired it

O_o

Anyone that was involved in Bitcoin 2009-2013 would have known that the block size limit was just a temporary anti-flooding limit and that the plan from the start was to make sure that blocks were allowed to get bigger with demand so that fees would remain low for the foreseeable future.

So my friend, **BTC** is the money that no longer functions as we expected it to when we acquired it."
2018-06-03,"An annoucement known for a month was released on a sunday afternoon where most people have the day off, but they call it brigading?

Genuine excitement for the crypto space is once again shit on by the dumb mods that run this place."
2018-06-03,"Your goal is to make profit and cash in on the crypto craze, just using crypto so it seems like you are doing something revolutionary "
2018-06-03,Seems like he is taking a different approach the last few weeks. Maybe to shill his new crypto notes?
2018-06-03,"Well, if you never want to use Bitcoin, and don't care if it goes up in value compared to national currencies, then sure, don't bother to support Bitcoin's value in increasing.

But why are you here then, if you don't care about Bitcoin's value?"
2018-06-03,"Cointext is your argument against LN possibly providing a fractional reserve for BTC?  Seriously?  A fucking *minority use case for BCH* versus *the officially preferred and endorsed L2 scaling solution for BTC*?

It doesn't even warrant an actual response.

Provide me with proof that Cointext is how BCH plans to scale en masse and we'll talk."
2018-06-03,"Only newcomers who bought at the top ask if crypto market is dead. Cryptos exists for nearly a decade, for god sake. This market is anything but dead."
2018-06-03,"Do you know of a way to stop people from paying 1000 sat/byte for their transactions? Dont you think that would skew your data?  

But you already know this.

If you look at BTC blocks, daily you see even 8 sat/byte transactions not getting into the next block every single time.  But with BCH, every single 1 sat/byte transaction gets into the next block every single time.  So your conclusion is false.  

You already know this as well.

Yet you twist the data to say something false.  You so want it to be true that BCH costs more to transact that BTC, but it simply isn't true.

And you already know this."
2018-06-03,"Just created a crypto apparel website and we only accept payments in crypto! Our goal is to get more people invloved with crypto! 

check us out at

https://cryptoonlyshop.com"
2018-06-03,"Yeah no matter what you think of him he's really the original crypto robber baron. That ""$1 bill"" will be a collector's item no matter what. "
2018-06-03,"You clearly don't understand why Bitcoin is so revolutionary if you think they way. Time and history has proven what is a sound money. It has also taught us what happens when governments are capable of changing what the money supply originates from (sound money principles).

The white paper explains how the network responds to paid transactions. It's not up for us to define what transactions are good for Bitcoin and what aren't. Satoshi's invention means that there shouldn't have to be all of these other cryptos.

Just because the network is ""fine for now"" doesn't mean it can stand the rest of time and adoption. Satoshi's Bitcoin can scale to Visa level transactions today. "
2018-06-03,"Yeah, I've gotta buy at least the first one. Stupid as shit but it'll be a piece of crypto history. "
2018-06-03,"Well I am biased because I’m a huge Vechain holder but I truly believe they can deliver, they said once they develop a specific use case  dapp for a company while it may take a month or 2 upfront it only takes days to deploy it for other companies with similar needs. Also if I’m not mistaken by the end of the year they should have the biggest team in crypto, yes they have the most ambitions but they’ll have the most man power to accomplish it "
2018-06-03,"oh sure, let's assume BCH has such an adoption that the blocks are filled to 90% capacity for an extended amount of time

do you know what that implies? that BCH adoption is AT LEAST 10X HIGHER than that of BTC right now. How are you going to simulate that?"
2018-06-03,"This gift card site now accepts Bitcoin https://giftcardsforcrypto.myshopify.com

I bought some amazing gift cards "
2018-06-03,"What is deception is referring to things like ""core"" as if a new dev team which calls themselves this took over the Bitcoin project."
2018-06-03,btctradefarm .com did well for me. I invested some bitcoins on their website and I got over 65% of my investment directly to my bitcoin wallet in less than a week. Thanks guys!
2018-06-03,"BTC, ICX, ENG, QSP, ETH"
2018-06-03,You realise 200mln dollars is daily volume of btc just on binance ?
2018-06-03,"Im posting this on the very last post on purpose. I've helped more than a few people on Reddit. Let me add a few more. First 10 people in Vzla responding here then sending me via PM instructions on how to set up, use and send money via bitcoin cash, ethereal and btc will receive a $ donation. To weed out the cranks need to attach picture of you standing outside your house with today's local Vzlan newspaper. Or copy of your school Id or work id. Huuuurry limited time offer. "
2018-06-03,yo thats a cool fucking name bitcoin turbo. Id' buy in if it wasnt a suckers play
2018-06-03,Then suddenly bitcoin isn't scarce
2018-06-03,"Agreed 100%. Goxxed here. Everyone was angry with MtGox and it's operator. Most lost site that there is still one or more thieves running around out there, leaving a trail of hundreds of thousands of Bitcoin behind. That is where most of the focus should be spent."
2018-06-03,"&gt; Bro, Bitcoin Cash just had its successful 2nd hardfork in May. Nothing bad happened. Monero hardforks every 6 months. So do a lot of coins. They are just protocol upgrades. Satoshi specified how to do them safely and indeed they are done safely all the time.

Your users have agreed to hard-forks as the proposition for opting into the currency. It is not fair to compare this against Bitcoin.

Monero can fork frequently because its user-base is almost entirely technical competent individuals who have no trouble securing their machines and updating this software.

&gt; Like when people last June bought $100 worth of bitcoin and were able to move it for a few dollars, then moved it last December when the fees were $50 per transaction and realized it didn't function as they expected to when they acquired it?

Short-term thinking. People in BTC are well aware of the fee problems and we're all looking forward for solutions. The debate is about how to achieve those solutions. The POV of Bitcoiners is that extremely large blocks can only lead to an increase in the centralization of mining and validation of their coins, which is another loss of confidence in that store of value proposition, because if mining becomes overly centralized then miners could collude to inflate the supply.

On the other hand, there's proposals for payment channels, which don't contribute to mining centralization and don't sacrifice some of Bitcoin's fundamental properties. People look at this more optimistically, and are willing to put up with those higher fees temporarily while we find the right scaling solutions.

It may be the case that hard forks are needed in BTC, or that we can't find an off-chain scaling solution after trying. We'll deal with those problems then. For now, people are confident that their money isn't going to depreciate because of rash decisions made to alleviate a short-term problem (and creating a potential even bigger problem in the long run). BCH may be adopted more by people who have nothing to store, and just want to use it purely for transacting. But then its less clear what advantage BCH really offers over plain-old cash."
2018-06-03,"Well retailer gets bitcoin that so many tout as the future of our currency and coverts it quickly to avoid losing value. The analogy about garage sale is one of quickly converting to something stable before it gets destroyed. 

"
2018-06-03,"""A professor of Byzantine history at Princeton once said that [John] von Neumann had greater expertise in Byzantine history than he did.""
source: https://en.m.wikipedia.org/wiki/John_von_Neumann

BitCoin solved the ""Byzantine Generals' Problem"" within distributed computing:
https://en.m.wikipedia.org/wiki/Byzantine_fault_tolerance"
2018-06-03,"We all know that

But there's more to bitcoin than the ticker symbol... and how I personally define bitcoin has nothing to do with its current incarnation. Everything that sold me on it back in the day was abandoned in BTC and continued on in BCH

Maybe that makes no difference to you and that's fine.. but it means all the difference to me and many others. People should make their own choice... But to say BTC is bitcoin and that's all there is to it? that is deception.. people should know what they're really getting into"
2018-06-03,"The import of this is massive.

It is the proposition for oracles, distributed computing (with a functional purpose beyond crypto-miner riddle solving), smart contracts etc (etc being everything I can’t recall from my first read-throughs of the website). Rewards will be in IOTA, no muddle of tokens, and feeless. Finally, you will be able to set up any device from an old smartphone to a high end computer to do computations, ie. no asics required. 
I’ve missed out a shit load, but that should give an idea."
2018-06-03,"I agree with your first statement, at the moment BTC and ETH look primitive. But talking for BTC as long as there is progress in the scaling issue i believe it will remain as the standard. Like how the USD is the finance worlds standard. "
2018-06-03,BTC - ETH - ADA - IOTA - ETHOS
2018-06-03,"Most Bitcoin enthusiasts know that, though I think there's also a subset of the population that sees retail availability as a trust indicator. "
2018-06-03,"Next time, sell the BTC on an exchange... "
2018-06-03,"You logic doesn't make sense. If you buy it because it appreciates, then what incentive would you have to spend it, when you're betting it will be worth more in the future? Anything you spend now could cost you thousands in the future under your logic. Thus, you'll have to buy it back at a higher price. *The higher the price of bitcoin goes, the poorer we become.*"
2018-06-03,"First you have to understand that LN is not banking. That might make it much easier for you to understand how this works.

I made a reply here that hopefully makes it clear: https://www.reddit.com/r/btc/comments/8o61l0/its_totally_clear_now_the_lightning_network_is/e01tk16/"
2018-06-03,"That is totally false. The government is not behind this. This is independent cafes and shops in Brisbane airport that mostly all accept Bitcoin via a 3rd party payment processor (I forget the name right now). It shows that Australians are maybe more progressive in some areas than other populations. It’s not a government conspiracy. The idea that cryptos are a secret government plot is totally ridiculous. I’ve researched every conspiracy theory that exists for over 15 years and I’d say most of them have some truth to them - this however is absurd. In fact I’d say there might be a conspiracy to spread this idea to try and turn alternative minded people away from what is actually a real grass roots movement by telling them it’s actually all run by ‘the government’.

"
2018-06-03,"The beauty of crypto is that money can be designed for different use cases. Bitcoin might be useful for large transactions requiring a great deal of security. Something else might be useful for smaller transactions. Or Lightning Network. Anyway, it's fine for now. Transactions have been fast and cheap lately."
2018-06-03,"As other have pointed out already. The average tx fee is a worthless indicator. 

Also, the only reason that BTC tx fee is relatively low now is because transaction volume is at 2015 level.

Also - even if you look at the average and not the median - BCH is still cheaper in $ value."
2018-06-03,Hard to believe r/btc used to have such quality posts...
2018-06-03,"**Bitcoin (BTC) Basic Info:** [Website](https://bitcoin.org) - r/Bitcoin - [Abstract](https://www.reddit.com/r/CryptoWikis/wiki/Bitcoin_basicinfo#wiki_short_description) - [History](https://www.reddit.com/r/CryptoWikis/wiki/Bitcoin_basicinfo#wiki_history) - [Exchanges](https://www.reddit.com/r/CryptoWikis/wiki/Bitcoin_basicinfo#wiki_exchanges) - [Wallets](https://www.reddit.com/r/CryptoWikis/wiki/Bitcoin_basicinfo#wiki_wallets) 

**Biases:** [Arguments For](https://www.reddit.com/r/CryptoWikis/wiki/Bitcoin_pros) &amp; [Arguments Against](https://www.reddit.com/r/CryptoWikis/wiki/Bitcoin_cons) | **CryptoWikis:** [Policy](https://www.reddit.com/r/CryptoCurrency/wiki/policy#wiki_cryptowikis_program_-_.28work_in_progress.29) - [Contribute Content](https://www.reddit.com/r/CryptoWikis/wiki/contributing)

---


*I am a bot, and this action was performed automatically. Please [contact the moderators of this subreddit](/message/compose/?to=/r/CryptoCurrency) if you have any questions or concerns.*"
2018-06-03,"This is a huge deal because airports see huge amounts of international traffic. This is probably the single largest event that has ever happened in terms of “spreading the word” about crypto. 

Plus, who cares if the retailers know anything about the technology? Do retailers know about the technology behind RFID chips? Probably not, but they make life a little bit better for everyone, which means customers and retailers alike want them. Crypto has some huge benefits over traditional banking, for both customers and retailers. "
2018-06-03,"It most certainly is in a bubble and most shitcoins will go to zero since they are worthless. Bitcoin will probably see further declines, but it will survive. "
2018-06-03,"OMG, one more conspiracy theory.

BTW the guy is wrong saying that USD&lt;-&gt;USDT is done only via BTC.  Deposit Tether to Finex and withdraw USD to your bank account. Or vice versa."
2018-06-03,"Another post that make new think op is spreading core lies.

It is very selective approach to data again. Bitcoin (bch) works fine on 1sat/byte and paying more is optional to get to the next block. 

Fees always were much lower on bch chain than btc chain.

Btc chain showed last tear that 1000sat/byte was needed last year to be sure to get to the next block. That's all due to 1mb block size limit.

Bitcoin (bch) has much bigger block size limit and fees are lower and will be always more likely lower than on btc chain.

"
2018-06-03,"Every community plainly downvotes/bans content that isn’t ‘yay mewn, wen 100x’ . This is the same for Discord, Telegram, Twitter, everywhere.

This whole crypto space is a pile of a shit and full of fucking idiots, stop getting emotionally attached to your portfolio, (If you are, then I’d recommend lower your stacks as you may be over invested). If this was a stocks and shares market you wouldn’t pull a hissy fit if someone said something you didn’t like would you? Enter in to polite discussion, and learn the other persons view and present yours OR move on.

FYI - I love majority of projects and have a VERY diverse portfolio, some projects counteracting and clashing with each other, but so many of you need to wake the fuck up and pull your head of that projects ass!

I really don’t care if I get downvotes here, as I think this entire space needs to grow a pair and enter into an intellectual and more importantly, open conversation.

Follow in the footsteps that lead this space, they mix and talk with SO MANY projects so they can learn and achieve more. Each respected community needs to step outside of their little box and learn about what else is going on and not immediately bash everyone because they don’t support what they do.

It’s embarrassing."
2018-06-03,Posting verifiable info is only trolling on r/btc 
2018-06-03,"Sounds like you need to do some more research. The fundamentals of bitcoin remain the same, as described in the whitepaper. The idea that segwit broke fundamentals was propaganda"
2018-06-03,"Sigh. You haven’t got it yet. Pay attention to the keyword ‘temporarily’.

Orphan blocks can be longer (or more aggregate POW) temporarily, but so what? What I care about is only long term.

In long term, only real Bitcoin will continue. Others will be ditched like orphan blocks.

Censorship and lies can help BCore shitcoin hijack the brand of Bitcoin temporarily, but certainly not ‘forever’.

At the end of the day, you have to compete by merits, instead of dirty tricks. BSCore style tricks can only hurt their own BCore shitcoin if you look at the long term."
2018-06-03,why can't you have pro-btc discussions on r/bitcoin ?
2018-06-03,"Btc was worth 1btc at ATH, no wonder the correction had to come"
2018-06-03,"Btc, eth, nano, req, lsk"
2018-06-03,This is so silly. The crypto community is filled with weirdos.
2018-06-03,Bitcoin cannot be both a currency and an investment
2018-06-03,"I oppose paying taxes om my cryptocurrency the same as i oppose most other bs laws. Just because they say so doesn't make it right and they are the criminals im my eyes.  
I also see cryptocurrency as one of the best ways to use civil disobedience to its maximum. 
It's non violent and completely peaceful and the more people that switch from fiat to crypto will help destroy this corrupt system. 
I actually believe that the 1% currently in charge could lead to our extinction through their greed and negligence if not stopped soon. "
2018-06-03,"Sharding.. think of it as subchains. Or think of it as all altcoins combined (and then some) with atomic swaps with bitcoin.  That way its ""easy"" to scale, the shards can be kept as large or small as you like, but of course, each shard will also have only limited security, and some might be quite vulnerable. Cross shard transactions will also have a serious latency issue. And of course, PoS has its own limitations. "
2018-06-03,"Let me repeat: You cant send those fake bitcoin anywhere, only between yourselves."
2018-06-03,"This is why bitcoin will never take off. It's already bad enough with cash scams, it will be worse with bitcoin since everyone will think it's ""secure"" because it's cryptographic and permanently stored, especially to those who are technologically inept. Even then, some tech savvy people have been scammed. "
2018-06-03,"BCH also increased in value compared to BTC in August, and in November 17, and was followed by a sharp drop as soon as some exchanges enabled people to take possession of their BCH and dump it. We've seen that short term gains don't matter.

What matters is that people can have confidence long term, that their asset will not become value-less. If they can accidentally have it stolen because they've not updated their client software, they're not going to have a strong confidence of it's longevity as a value store. Even those who don't use their own client and have an online wallet provider must expect that their provider can keep up-to-date with frequent updates pushed by a hard-forking autocracy, else they could be locked out of the funds until updates have been made."
2018-06-03,ETH / BTC / NEO/ WTC / XLM
2018-06-03,This is good for bitcoin 
2018-06-03,"What did you criticize? And I don't see low quality ""to the moon"" comments in here, instead I see a lot of people elaborating the significance of this event for Walton and Crypto in China in general..."
2018-06-03,"The recent power outages made me wanna post this 
https://www.facebook.com/permalink.php?story_fbid=1505133839590708&amp;id=1499904090113683

Not about crypto but interestinf"
