Date,text
2018-06-03,"i thought all hope was lost with bitcoin investment until a friend of mine advice me on how to get better with bitcoin investment rather than falling into this usual highlighted internet scammers who claim they want to help you increase your btc and thereby run away with your btc,since he advice me to get a bitcoin mining machine so as to do all the mining at my convenience rather than falling into this online scammers ,though it was quite expensive but was worth it,since i started using this machine i have made x 30 profit  of the amount i used in purchasing the machine .For more information contact +19293148512 and email at bitcoincyber@gmail.com   "
2018-06-03,"Ha. You want me to do the dirty work, shifting the burden huh? So Gavin left at some point in 2014, so instead of looking at the code, how about I serve you a quote from Jeff Garzik from 2012? I mean, 2012 &lt; 2014, so Gavin was still heavily involved. The same questions were popping up then... let's see what Jeff had to say:

&amp;nbsp;

Question:

&gt;&gt;Would it be possible to force a blockchain change without having the processing power to backup that block chain switch?

Answer:

&gt;*There is no ""force"", there is choice.  Each user chooses the software they run to validate the chain.  If a majority of users choose to switch to SHA-512, that is what will happen, regardless of the number of miners who switch.*

&gt;*51% hashing power, or even 90%, means nothing if clients collectively refuse to accept and relay your blocks.*

 --- Jeff Garzik, July 14, 2012

See full thread on [bitcointalk.org](https://bitcointalk.org/index.php?topic=93366.msg1031394#msg1031394).

What gives??? Jeff seems to be saying the same thing as myself!! And, of course, you'll remember that the community turned against Jeff last year, as he was trying to force S2X. Hardly a ""Core fanboy"", is he? Hmmm....


&amp;nbsp;

But I'm sure even Jeff was just blinded by ideology, just like me. And he was blinded by it 6 years ago, you know that same ideology that wants to cripple Bitcoin because Core/Blockstream/AXA/Bilderberg. Which was a thing even back then, even though it was established much later ;-)"
2018-06-03,"the hat and the beard are irrelevant, what's noteworthy is that these guys keep trying to convince anyone that btc fees are cheaper than bch, which is an incredibly stupid thing to say."
2018-06-03,"Thanks I guess. As I said I did manage to make the payment in the end. I get some of your logic, people being inept and sending bch to a btc address etc must cause issues, but I wish there was some sort of advanced mode where it just gave me an address to send to, as I have done many times before.

It doesn't help that this change isn't that well communicated. I got to the final screen with the QR code and was looking for the link that used to be there to send the payment manually.

I then plugged a webcam in that I had to dig out of the loft to try to scan the QR code into the ledger app (obviously that didn't work), before copying the link into notepad hoping I would find a wallet address.

It all became a massive saga, and I now know I hate electrum, but I feel like there was more chance of me messing up and losing coins going through this process of juggling wallets than there was on the old process."
2018-06-03," those with pockets over flowing with wealth will always get the biggest basket over those with a moderate amount to invest, especially now with more wide acknoledgement of the Crypto market. "
2018-06-03,Time to realize that Bitcoin has been sub-10k for months now and won’t be going back up?
2018-06-03,"Wanted to inquire about something to WaltonChain sub prior to investing a significant amount.   Wrote a respectful post. 

Post got deleted despite fair amount of upvotes.  Then got muted from entire sub for 72 hours.  

Quite troubling this is the state of crypto-  if we want new money to come in,  we all need to be more open to answering questions from investors. 

"
2018-06-03,"The apparent 'bull run' is still seeing the world from a fiat-centric view point.

Whatever the number is that those in the fiat-centric perspective honour as 'the price' of Bitcoin, 1 BTC is still 1BTC.

Look, I too have to interact with fiat and believe me, it can be infuriating to have to let go of anywhere between 5,000 and 25,000 Satoshi per fiat USdollar because that 'market' is so damn volatile. But I deal with it and move on. It really is quite unimportant in the scheme of things."
2018-06-03,"You can say that about every crypto. Fact of the matter is, no body is really using any of them at this point.

But req is a solid piece of working software. So I really don't know what you have against it honestly. 

Or do you just like making comments you think are witty?"
2018-06-03,"Scenario 1 and 2 are essentially massive network failure or segementation attacks. To be clear, no crypto on the planet survives this today without critical problems. Any blockchain with any proof type will fork in these scenarios. "
2018-06-03,"&gt;people don't give a damn what the name tag is.

People give a damn if it affects their investment. We're playing with people's money here and they need to know what chain they are buying and transacting on.

The only reason you think the analogy is shit is because it highlights that ethically you should not steal the brand of something and claim to be that thing just because the original version of that thing has changed.

I think the BCH community is doing itself a massive disservice by pressing this whole ""bitcoin cash is the real bitcoin"" narrative. All that time wasted peddling this lie could be spent educating people on the technological merits of BCH."
2018-06-03,"I do and I don't. 

1. It's not necessary

2. Crypto is revolutionising the future, so why not move onto ternary, at some point it'll just make sense anyway."
2018-06-03,"I remember a video of Andreas saying that if the government ever took over bitcoin, we'd just fork the code. I've been trying to find that because it basically predicted BCH."
2018-06-03,Bitcoin Cash proves that an uncorrupted version of Bitcoin will always be exist.
2018-06-03,"Your submission has been flagged and removed because it relates primarily to bitcoin mining. If you would like to learn more about mining bitcoin, please visit /r/BitcoinMining. Be aware that bitcoin cannot be mined using graphic cards. Specialized ASIC hardware is required.

^^I ^^am ^^a ^^bot ^^and ^^cannot ^^respond. ^^Please ^^contact ^^/r/Bitcoin ^^moderators [^^directly ^^via ^^mod ^^mail](https://www.reddit.com/message/compose?to=%2Fr%2FBitcoin) ^^if ^^you ^^have ^^questions."
2018-06-03,Anyone else legitimately disappointed in themselves for how much time they spend on crypto stuff? I don't even daytrade. Tuning into every little crypto detail despite mostly holding for now is bad for the soul. 
2018-06-03,"For new people, Andreas used to be one of the most well-spoken leaders in Bitcoin. His understanding of the vision in 2012 contradicts his siding with Core in 2015-2017.

What made him completely switch personalities? Money? Threats? Was he cloned??? We don't know..."
2018-06-03,"   
Good evening, my girlfriend and I would like to get married, but I do not have the money to realize this dream. We are running behind, selling sweets on the street and working hard to achieve our goal.  If you are willing to help us, we are accepting donations to fulfill this dream.   

Bitcoin, donation for marriage: 1LmnVrEfyEoX5V4aHzK4WZgYZzkb39ER1h  

Litecoin, wedding donation: Lfhnj8qBbKFwCdidQWnrz2hYejEKA3zKNc "
2018-06-03,"&gt; Blockstream, in collaboration with an initial set of launch partners, is excited to announce Liquid, our first **production** sidechain.  
  
  

&gt; As a Bitcoin-centric company, we are excited **to be delivering** a real-world solution that moves the ecosystem forward"
2018-06-03,"Bla bla bla....

We are taking about 'illegal bitcoin', there is no such thing.

If some oppressive regime like the Umercan gov decides something is 'illegal', that's their problem, but it don't make it so.

Better you examine where your thoughts come from, realize they are actually not your own and that they have been implanted into you, get off of the media, especially the narrative controlled social media and then release your mind. 

You might even learn something or quite possibly, with practice, in time even have an original thought that actually is YOUR thought.

In the meantime, stop wasting my time with repeater drivel. There's a revolution at foot."
2018-06-03,"JIKES. You can really hear the crowd hesitate to clap when he suddenly drops the Bitcoin Cash bomb on them (""wait, that wasn't negative was it?"").

I'd agree that petty disagreements and minor issues shouldn't stand in our way to make Bitcoin what it should be. Problem is what finally culminated into Bitcoin Cash hasn't been due to anything close to a *minor* issue and the disagreements haven't been *petty* at all.

If anything saying these things now just show signs of capitulation. It's kind of like they've been thinking ""uh-oh, maybe we shouldn't alienate this BCH crowd after all"" and I bet we'll start seeing more tactics to try and lure people back into legacy Bitcoin from now on."
2018-06-03,"There is a small mountain of transactions building up today. This post is a reminder of what can happen when a network cannot handle all transactions continuously.

If you have any plans to transact BTC, you have to be aware."
2018-06-03,"Wow, it really happens this easily? BTC is worse than I thought."
2018-06-03,Please link to me a crypto project that has faced criminal charges.
2018-06-03,"Its crypto. If Tron can be top 10, then IOTA can be right beside it."
2018-06-03,"Hi, /u/ault92. James from BitPay here. We're sorry to hear you had trouble paying from your Ledger wallet – our goal isn't to stop anyone from paying with Bitcoin (we only succeed as a business when people can pay). 

We are working to make adoption of Payment Protocol easier for other wallets (including hardware wallets), and we have made a [simpler version of Payment Protocol](https://blog.bitpay.com/json-payment-protocol/) available for easy implementation. We'll be posting updates soon as more wallets make this secure payment option available. 

In the meantime, [here is a walkthrough](https://support.bitpay.com/hc/en-us/articles/360000245586-How-to-Pay-a-BitPay-Invoice-with-a-Hardware-Wallet-and-Desktop-Electrum-Wallet) for using Ledger with a secure Payment Protocol wallet. Please let us know if there is anything we can clarify or explain better! 

Our choice to require payments from [secure Payment Protocol wallets](https://support.bitpay.com/hc/en-us/articles/115005701523) wasn't arbitrary.  We made the switch to protect purchasers and merchants from the cost of payment mistakes and guarantee a successful payment experience. Across the BitPay platform, various failed payments and overpayments once ranged between several percentage points to up to 10% of payments processed. After Payment Protocol, that percentage is now less than 1/10th of a percent. Payment Protocol wallets work, and they prevent serious problems that can discourage people from using Bitcoin for commerce payments: https://blog.bitpay.com/bitpay-and-payment-protocol/

That said, we're sorry we didn't communicate this clearly enough to prevent confusion for you when you went to checkout on updated BitPay invoices. That's on us, and we take responsibility to make the payment experience as simple and seamless as possible. Thank you for your feedback! "
2018-06-03,That's why real Bitcoin had to fork from the hijacked code repo
2018-06-03,Ive yet to see one crypto indictment and there are hundreds of obvious scams. To think EOS would be on that list is far-fetched at this point.
2018-06-03,"So you admit that the title is wildly misleading? 

I believe they are exactly like cash. It's just a normal Bitcoin transaction between two people, but since we plan to send back and forth to each other we just send the final balance once when we're finished. All secured by exactly the same trustless technology as Bitcoin. 

There's always going to be some people with more Bitcoin than others, and therefore more ability to stake coins in channels to earn, but we all play on a level playing field, they have no more ability to do things than anyone else. 

As for transacting on a different network, yes, You are. But You are transacting in exactly the same currency. You have the signatures that represent unspent outputs. Try applying your logic to physical coins. It's irrelevant where the signatures are stored as long as I have access to them and I can 100% verify that they are valid on the blockchain."
2018-06-03,"Alright, if you want to have consistent professional adult conversations about crypto, Reddit isn't the place. Seriously, Reddit is the bottom of social media. You have to join communities where people can't hide behind anonymity.  Try a LinkedIn group or something, but as long a you are here you have to accept reality and just train your mind to sift through the BS."
2018-06-03,"I am skeptical of any coin supposedly ""backed"" by something else. Too much counterparty risk. I'd rather just buy bitcoin"
2018-06-03,"well, it exploded because of the 40 USD transaction fees on the bitcoin network at the end of 2017.

and it's not that it's a few seconds faster than other coins, most other coins take minutes to hours to complete a transaction (it's very likely that a Bitcoin transaction takes over an hour).
granted, bitcoin is pretty much the worst case here, but instant is way better from a user experience point of view than even just 1 minute.

for paying in person, more than 10 seconds is unacceptable.
for paying online, the longer the user has to wait the more likely they are to be paranoid as hell about inputting the wrong address or similar, and it just slows down the process.

now let's get to fees: if you want to buy something for 20 cents, paying another.. say 20 cents for transaction fees sounds pretty ridiculous. for bigger transactions it's not a huge issue of course, but for especially for people in poorer countries crypto fees can be quite high, especially when they are actually being used, just like December 2017.

Also its just nice to be able to move funds without losing some of them each time you do so. and at the same time it's instant. it's just a way better experience.

you can actually try it out on nanovault.io 

set up a wallet there and get some free Nano from nanofaucet.org

should take less than 5 minutes. "
2018-06-03,"But it's tilted the wrong way. 

People could be like ""oh the ""b"" is tilted forward so I guess it must be some kind of environmentally friendly Bitcoin?!"".

What if those people then try searching Googles for ""environmentally friendly Bitcoin"". What if then the Google machine spits out the result ""You're as idiot! That's clearly just Bitcoin...duuurrr...""

People could be offended by that and hate on the OG BTC. 

That's bad. "
2018-06-03,"I'll get downvoted and you'll get upvoted. I like bitcoin but I also like speaking the truth.

Looking through your posts for 5 mins I see:

You buying in to bitcoin in December/Jan:

&gt;even though I didn't get in in 2010 when i could have bought a TON of bitcoin, I'm on it now. Bitcoin is the future and i already made over 200 dollars since investing 2 weeks ago :D

&gt;im going to keep adding a little here and there, keep em in my vaults, get a hardware wallet and keep it in my safe and keep adding the coins to it over time.

&gt;Thank you all for the support here! I can't look in the past of what i COULD HAVE done in 2010. I was there...i was RIGHT THERE about to spend realistically now 800 dollars on bitcoin, was going to do ""buy now!!"" but I didnt...for some reason i panicked. I i should have just done it.

&gt;Oh well! I can't look to the past, only to the future! this..is JUST the beginning! Thank you fellow bitters :D

And then Three months later I see:


&gt;The great bitcoin crash, of 2018. just like the 2013 one :( ugh. I'm hodling out hope, but i seriously hope that fall rally wasn't some fluke. this is mega odd

So I don't think you are really looking at the big picture. I think you are letting other people influence you. Really think about what you are doing. Don't listen to me, don't listen to 99% of the people on this subreddit, think about it yourself."
2018-06-03,"Sorry guys.  I've been in Bitcoin since early 2015 *(later than many)* and obviously my investments have done me well, but articles like this is the true reason I'm in cryptocurrency and physcial gold before that.  

The more the public understands this the faster they can take back their liberty. "
2018-06-03,"^The linked tweet was tweeted by [@verretor](https://twitter.com/verretor) on Jun 02, 2018 23:22:14 UTC (2 Retweets | 7 Favorites)

-------------------------------------------------

[@BTCorBCH](https://twitter.com/BTCorBCH)  [@theonevortex](https://twitter.com/theonevortex)  [@TweetyBirdbrain](https://twitter.com/TweetyBirdbrain)  [@alansilbert](https://twitter.com/alansilbert)  [@mikeinspace](https://twitter.com/mikeinspace)  [@MrHodl](https://twitter.com/MrHodl)  [@Th3Acist](https://twitter.com/Th3Acist)  [@mindstatex](https://twitter.com/mindstatex)  [@bradmillscan](https://twitter.com/bradmillscan)  [@cryptotux](https://twitter.com/cryptotux)  [@derose ](https://twitter.com/derose ) Bitcoin mempool is empty. I rest my case. 

[Attached photo](https://pbs.twimg.com/media/DeuQe82WAAEIC0H.jpg:orig) | [imgur Mirror](https://i.imgur.com/ONnAKzq.jpg)

-------------------------------------------------

^^• Beep boop I'm a bot • Find out more about me at /r/tweettranscriberbot/ •"
2018-06-03,"Wath towers are like an extra incentive. ""Don't think noone is watching you, for all and everyone might be"".

You can always watch yourself. But someone might have knowledge that your node is likely down for a long time. Watchtowers is the final bit in the puzzle, here. Not going to be used much - as in they won't have much work to do (unfortunately, but I still plan to run a free or very cheap watchtower service, just because I can) - but still an important part for the game theory that governs a lot of crypto. Also LN."
2018-06-03,"BTC
ETH
LTC
NEO
BAT

BTC is the most secure and robust of all the coins with the strongest developer support, so it's clear the #1 option for most of us.

ETH's dApp ecosystem is a cauldron of innovation in the space that is sufficiently differentiated.  I'm excited to see what comes out of hte space.

LTC has proven it can fit within and complement the entire cryptospace.  LTC scaled with Lightning appears to be a winning solution for scaling small payment transactions in the greater bitcoin ecosystem.

NEO has a lot of the same appeal as ETH and the payout in Gas makes it an attractive investment.

BAT, if scaled right, could topple Google and Facebook's advertising empire.  The development team is solid, the Brave browser looks beautiful and concept is appealing.  I am skeptical about their ability to successfully pull off the BAT model but if it's successful we're talking a multi-billion ad market they can disrupt with a solution that improves privacy, security and ad delivery.

I think you also have to consider XRP and XLM as a viable investment in settlement layer tokens despite the philosophical disagreements because the market seems to be gravitating towards them."
2018-06-03,"LOOKING AT THE RATE AT WHICH CYBER CRIME AND INTERNET FRAUD HAS INCREASED DRASTICALLY ALL OVER THE GLOBE, I THINK ITS HIGH TIME WE STOP PROMOTING AND FALLING INTO THIS SCAMMERS, I HONESTLY FEEL ITS HIGH TIME WE GET INDEPENDENT. BITCOIN IS ACTUALLY A CAPTOR CURRENCY THAT HAS GROWN ALL OVER THE GLOBE, AND HAS CHANGED A LOT OF LIFES, INSTEAD OF INVESTING YOUR BITCOIN WITH COMPANIES OR INDIVIDUALS ON THE INTERNET, PEOPLE YOU CANT SEE AND BARELY KNOW IF THEY GENUINE OR FAKE THERE BY PUTTING YOUR MONEY AT RISK KNOWING THE CHANCE OF YOU BEING SCAMMED IS HIGH, YOU CAN EASILY DO THIS ALL BY YOUR SELF, SAVING YOUR MONEY, YOUR TIME AND SAVING YOU FROM BEING SCAMMED.

ITS CALLED A BITCOIN MINNING MACHINE, ITS EASY, AFFORDABLE, AND SAVE YOU ALL THE STRESS. THE BITCOIN MINNING MACHINE ITS ACTUALLY A HARDWARE DEVICE AND CAN BE CONNECTED TO YOUR DEVICE, AND WITHIN 3 DAYS YOUR BITCOIN WALLET INCREASES BY 0.1BTC, IT CAN EASILY BE DELIVERED TO YOU AND 0&amp;#37; RISK INVOLVED, GET YOUR BITCOIN MINNING MACHINE TODAY FROM for more information message whatsapp at \+19293148512 [bitcoincyber@gmail.com](mailto:bitcoincyber@gmail.com)"
2018-06-03,"They tried to say the year long ICO was about distribution and preventing cartels but they know cartels can't be prevented. The real reason for the year long ICO was to make as much profit as possible and to allow behind the scenes accumulation. Block.One has officially stated that ICO proceeds are all profit. The vast majority of this money will not be going to development of the platform (unlike most ICOs which at least use the ICO to fund development - not line the owner's pockets). I hope Dan and his father Stan end up in jail for flaunting Securities laws. I hope you all know Stan Larimer was behind the AriseBank scam. Look it up. 

https://medium.com/@arnold_90210/stan-larimer-and-michael-taggart-actively-promoted-arise-bank-see-multiple-posts-on-medium-b11a1b34be57

https://medium.com/@arnold_90210/stan-larimer-and-michael-taggart-actively-promoted-arise-bank-see-multiple-posts-on-medium-b11a1b34be57

Block.one, Dan Larimer, and Dan's father have been selling ETH constantly and buying up a large percentage of all circulating EOS behind the scenes. The reason for doing this is twofold. dPOS systems will always devolve into a couple of cartels holding a majority/controlling amount of the tokens because of the intrinsic financial incentive to do so. Tokens in a dPOS system have not only their base trading value (the amount a token can be sold for on Binance at any given time) but an additional value in the equity they represent in the Block Producer positions. The block producer spots are the most valuable thing in the EOS ecosystem by far and are the main benefactors of the annual inflation (after 30+ years there will be far more coins created through inflation than exist right now. The current supply will be a drop in the bucket so you can see how important/powerful these BP spots are. 5% annual inflation). Small and medium holders of EOS tokens will never realize any of this BP equity - they simply have no shot of ever becoming producers. They may receive a small kick back from a BP for their vote is all. A large portion of the value in the EOS token will be wasted on most holders. As the large holders accumulate/control more tokens the value of their tokens rise collectively and exponentially (rather than linearly as would be the case with token accumulation of for example BTC) because they will realize an increasing amount of the BP equity from their holdings. Eventually cartels form that hold so many tokens that they can always vote themselves in, act with relative impunity, and never be displaced by opposing parties and at this point the cartel is realizing 100% of their token's BP equity because the cartel owns the block producer spots and gathers all of the block rewards (without having to distribute portions of the rewards for support).

So you see here the flaw with dPOS and why the economics dictate that tokens will pool into huge individual groups over time in order to maximize their value/utility for the holder. The Larimer Gang knows this. They have seen what has happened with other dPOS projects like LISK and even their own creations Bitshares and STEEM. Dan knows the only way to prevent this is to basically beat everyone else to the punch. Dan himself is accumulating a controlling share of EOS tokens. This way he can control the BP spots himself or at least prevent anyways else from gaining undue influence. He will be able to maintain a semblance of decentralization while controlling EOS from behind the scenes.

BTW, The year long ICO wasn't created to prevent cartels from forming. That is nonsense. Cartels form over time because of the dPOS incentive system; they aren't just made by single groups buying a ton out of the intial ico supply. Initial distribution in the dPOS case doesn't even matter much because while a more even distribution may slow the formation of cartels it will not prevent it because the flow of tokens over time will be the same either way; they will aggregate into large single holdings where their value is maximized. If token x is worth more to person A than to Person B, then x will tend to flow from B to A over time. Simple as that. The reason for the year long ICO is so that Block.One and Dan can more easily disguise their own accumulation. It doesn't matter to them what the cost of the EOS token is because they are buying using the ICO ETH. The more EOS costs during any given phase of the ICO the more ETH they gain during that period to offset the rising cost. They can buy the same amount of EOS each round no matter the price without ever digging into their own pockets. They are the only participant that is unaffected by the rising costs over time in this style ICO making it much easier for them to accumulate a large stake than for other interested parties."
