Date,text
2018-06-03,"Yes fiat is the value that matters, always. Unless you believe that btc will dominate usd in the future. The notion that btc ratio is of utmost importance is something created by btc purists (people holding roughly 90 percent or more btc). "
2018-06-03,"So you're just going to let them walk away with 3 of your bitcoin and you're not going to do a fucking thing?

Get a gun or a machete, get some of your friends and fuck them up the asshole with a rusty broomhandle and then take your money back. If these fucks did this to me or my friends there would be bloodshed and I'd get the money back too"
2018-06-03,"denominated in an inflationary system

not peer to peer

censorship prone

yada, yada, yada

basically, all the advantages of crypto"
2018-06-03,"Yeah of course!

Bitcoin Cash qrkf4qxgyx8hj524v5p0c6lz0ug9qk68zsda568nck

Ethereum 0x27C8099AA5D7939BBe67266d252772870Cc3C2F3

Btc 16etXquqjBTxiGRUP7zFBTvwzJMoKLfTLj"
2018-06-03,"Fantastic news!

Bitcoin Cash is Bitcoin"
2018-06-03,"Less than 5 billion dollars worth of BTC changed hands (on exchanges) in 24 hours.

That's quite low."
2018-06-03,"It's really cool that they've written  btc and ltc as accepted payments boldly.. and then,


'oh btw we also accept cards.. meh'"
2018-06-03,Here what he can do. If he want to keep the price as is. He buys bitcoin and stores it in USDT. when he reached destination country he can buy bitcoin and sell it off. I dont' know why is it so hard for them instead of going through all these hassles. 
2018-06-03,"&gt; Every community plainly downvotes/bans content that isn’t ‘yay mewn, wen 100x’ .

That's definitely not the case with r/btc, people detest memes there."
2018-06-03,"So Bitcoin should only change its name when forked by Bitcoin Cash? What gives Bitcoin Cash this special privilege over other forks, like Bitcoin Gold?

Also funny you should mention Bitcoin Clashic, which is a fork of Bitcoin Cash. Should Bitcoin Cash now change its name to differentiate itself for Bitcoin Clashic, as being a fork from the original Bitcoin Cash?

The ongoing discussion."
2018-06-03,I don’t see why using only Bitcoin and not voting favors using only Bitcoin and voting. Using Bitcoin is definitely great I think but not voting doesn’t help much while with voting you have at least some influence in the direction of legislation as a collective at least.
2018-06-03,"Your submission has been flagged for removal because it doesn't meet the quality standards for /r/Bitcoin at this time. 

^^I ^^am ^^a ^^bot ^^and ^^cannot ^^respond. ^^Please ^^contact ^^/r/Bitcoin ^^moderators [^^directly ^^via ^^mod ^^mail](https://www.reddit.com/message/compose?to=%2Fr%2FBitcoin) ^^if ^^you ^^have ^^questions."
2018-06-03,"You are quite the keyboard warrior. LN is not something the avg person or business is going to even consider. But please keep up your fight. I will continue using Bitcoin cash, on chain, from a mobile wallet like I have been for 5 years. BCH, what you still refer to as ""bcash"" like a proper cultist, is 1 satoshi/ byte and clears in 3 seconds. Works for me and thousands of others right now. "
2018-06-03,"If I plan to go from Alt-BTC and then directly BTC-FIAT why should I care about the ratio? In this scenario isn’t it only the $ value that matters. Ratio only matters when trading, not going to fiat"
2018-06-03,I know shops like hipptee.com list prices in USD and all crypto they accept...i really dig this idea or way of doing it.
2018-06-03,"No, that's not the case, read the artical and read the comments on the github page. It wasn't an old state that was broadcasted. The lightning node did not pickup the channel close tx so the funds were not returned. No one was able to double spend any funds, someone lost money due to a bug that was ultimetaly recoverable, saying things like I can double spend whenever I like is just bs. If it was possible everyone would do it and bitcoin core would goto zero. "
2018-06-03,"I'm so tired of this ""HODL"" meme. The sad part is it's clearly more than just a meme now, it's the crypto slogan. Blindly holding worthless coins that are plummeting in value and sinking further and further in the hole."
2018-06-03,"^The linked tweet was tweeted by [@hernzzzzzz](https://twitter.com/hernzzzzzz) on Jun 03, 2018 14:13:12 UTC (1 Retweets | 7 Favorites)

-------------------------------------------------

Since Aug 1st when BCH forked off the network, it's hash power has deceased by more than 10% but bitcoin's hash rate has increased more than 5x. \#bitcoin \#notshitcoin 

[Attached photo](https://pbs.twimg.com/media/Dexb3eSU8AEZhwV.jpg:orig) | [imgur Mirror](https://i.imgur.com/hLZZD0P.jpg)

 [Attached photo](https://pbs.twimg.com/media/Dexb7vWVAAIllPQ.jpg:orig) | [imgur Mirror](https://i.imgur.com/hIxzrJn.jpg)

-------------------------------------------------

^^• Beep boop I'm a bot • Find out more about me at /r/tweettranscriberbot/ •"
2018-06-03,"Wow your fuel is so cheap, 

Why dont you put your crypto address here maybe some rich men send you 💰"
2018-06-03,"How sweet you are, so naive. Of course governments can ban companis from accepting Bitcoin. What's more, governments can even force you to hand them over all your Bitcoin. We're all government's little whores. "
2018-06-03,"They can't just outlaw stuff !!! Otherwise they already would have. 

They have to convince people there's a good reason to outlaw, thus the whole bitcoin is for tewowists and peterfilesand is wholly responsible for global warming etc. narrative.

My Friend, it's not like they ain't trying.

It just isn't working.

That being said, one of THEIR narratives has been swallowed hook, line and sinker by EVERYONE, bitcoiners and nocoiners alike:

That bitcoin is a type of digital asset that is valued in fiat terms and subsequently gets bought and sold for fiat to hopefully increase one's fiat wealth. 

The last thing they want ANYONE to think is that. God forbid, Bitcoin is the silent revolution, whereby WE - real people - take part in a small way (each and every one of us) to quietly remove the power of a select few to create money out if thin air to lord it over the rest of us and throw fake fiat funded wars."
2018-06-03,"I stopped paying them with BTC, too. Would like to re-start with BCH as well. As long as they don't offer that, it's back to EUR bank payments."
2018-06-03," This remember last day when i received 0.16 BTC from my 0.08 BTC investment on Btc2Double.

I'm still compounding that amount to hope reach the 10 BTC target! haha"
2018-06-03,"It's absolutely possible. They could also easily make it illegal to use crypto for currency exchange, or make it illegal to use for international exchanges etc. 

People say it's anonymous and they can't track you. Although this is true for the most part. News of this would cause enough people to lose hope and not want to get involved out of fear. This would kill the market. "
2018-06-03,"Yes, that exact same thought crossed my mind also, and I am sure is something bankers would want to have, in order to keep their control in crypto system... last thing they want is properly working Bitcoin system, one that is usable and available to everyone, anywhere, any time ;-)

BITCOIN CASH IS THE REAL BITCOIN

BTC is banker's shit now... stay away from it... and stay away from SegWit and Lightning."
2018-06-03,"Damn! 4K I would love to hear people’s thoughts on if it hit that low, what would be the feelings in this sub and about bitcoin? Would bitcoin hitting 4K mean that eth would replace it or would that mean eth would also fall, along with all alts?? Xrp would dip to at least 30 cents. Although it wouldn’t be good at present time, I feel it would be good for crypto moving forward if this pushed us off bitcoin and this created waves for even more fiat pairs. "
2018-06-03,"I agree with everything you say. Sadly this is a general problem on the internet. She er something new and fun starts, all the fun, smart and creative people start out. This attracts more people because of t how great the first people are. Eventually the naysayers come, brining their toxic shit everywhere. Everywhere.... YouTube, reddit, Twitter. All topics. Eventually the fun people leave, and only the toxic fucks are left.  

Crypto, football, league of legends, electric cars. Every topic.   
Some guy who bought a Tesla gave some positivt critism to Tesla (how can get they better if they don't get feedback?) first reply was some redneck fuck who loves Tesla like a religion, saying ""you don't deserve to have a Tesla, you ungrateful fuck"".   

Every damn place. Even at work :(



"
2018-06-03,"Well Bitcoin ABC is a fork of Bitcoin Core, i.e. a copy. If you dont believe me just have a look at the code."
2018-06-03,"www.virwox.com is the only place where you can buy Bitcoin with Paypal; it involves buying Second Life Lindens first then trading those into Bitcoin. The exchange rate may not be the best either. 

It’s been a long while since I bought on there so I don’t know if anything has changed with it. "
2018-06-03,"Governments can ban whatever they want. Whether it is in their interest to, is another matter. 

I don’t see any immediate threat to Bitcoin from major governments. There are a couple of things that may trigger considering a ban. 

- if bitcoin is difficult to tax
- if it is difficult to police, such as checking accounts of criminal activity and recovering funds used in criminal activity. Like money laundering"
2018-06-03,That doesn't change the fact that Bitcoin is a single specific currency.
2018-06-03,"\&gt; Sells crypto

\&gt; Price increases $0.01

\&gt; Shit I didn't sell the top

\&gt; Buys back in"
2018-06-03,"In what sense are you suggesting they ""can be considered one entity""? Also, do you mean BTC.com instead of ViaBTC? Regardless, the hashrate could move to another pool tomorrow so where's Wu's control? 

And if you simply mean that these pools share a vision for Bitcoin Cash then that should really come as no surprise. The incentive structure is built for honest miners to agree on what's in their best interests. It's only dishonest miners that are punished, and colluding dishonest miners that we are concerned about. "
2018-06-03,"Sure. Bitcoin isn’t ready yet to take on the big payment processors like VISA. 

Bitcoin has a second layer that is being developed, called the lightning network (LN). Lightning will allow instant transactions with almost zero fees. They can be peer to peer and will have a very easy interface. It will be like contactless payments, but will allow peer to peer and online shopping too.

Imagine you owe your friend £10. They select the amount, you scan the barcode on their phone screen and hit confirm. Transaction done. 

This tech should be ready within the next year or two. You can trial it now, although if you aren’t very tech savvy it may be a bit complex. "
2018-06-03,There's a few of those departments and they have been highly effective for decades. But bitcoin is a different beast altogether.
2018-06-03,"Bigger picture! If an official agency is trying to educate the public, what does that mean for crypto mass adoption?

Maybe not today, but definitely tomorrow. "
2018-06-03,"There is nothing like an iou about a ln tx. The ln tx is an updated channel state, that itself is exactly a bitcoin. The only thing you need to do when you get a ln tx is to dwcide whether to broadcast the tx or not. 

Are you saying that when satoshi suggested his version of payment channels, that it was not bitcoin the people transacted in? And this is exactly the same for 0-conf."
2018-06-03,"I got really drunk last night and had the idea that the tarrif war between the u.s. ,Canada and EU would cause an American great depression situation. Cause a possibility of a few things. Everyone who holds would eventually have to with draw all funds to make it through a depression cause the crypto market to faulter , but with the u.s realising we are headed to a world currency ,put them in a place to buy larger quantities becoming the market leader and allowing fluctuations. The other theory is that America knows we are headed to a crypto based economy and is trying to destroy the American dollar.
    I was pretty hammered and I get a little conspiracy theoristy."
2018-06-03,"Can’t go wrong with the two big boys - BTC and ETH. 

After that, I would recommend OMG ENG XLM XRP NEO ICX IOTA. "
2018-06-03,"You EOS boys are fucking deluded, no way EOS will ever overtake ETH, Vitalik is just too smart and gets it better then almost anybody else.You are welcome to try and become better, nobody is gonna say a word if you do, but stop promoting EOS like its some ETH killer and how it is the future when nobody knows that for sure.

Clinging on to blind fanboyism in this space will get you burned badly, and everything still depends on BTC, if if takes a shit EOS will as well, so much for revolutionary tech in EOS.

I rest my case."
2018-06-03,"Spend and replace. Exactly like this. Keep your BTC balance constant.

But also, HODL

It keeps the nefarious forces from fooling people into trading their leaderless hard money for their fake fiAt that THEY create at will out if thin air."
2018-06-03,"You also do this with DOGE, also ""the real Bitcoin""?"
2018-06-03,"This remember last day when i received 0.16 BTC from my 0.08 BTC investment on Btc2Double. 

I'm still compounding that amount to hope reach the 10 BTC target! haha"
2018-06-03,That is totally false. The government is not behind this. This is independent cafes and shops in Brisbane airport that mostly all accept Bitcoin via a 3rd party payment processor (I forget the name right now). It shows that Australians are maybe more progress in some areas than other populations. It’s not a government conspiracy! 
2018-06-03,"it's not really spam? there is no referral link etc....?

just new news about crypto really"
2018-06-03,"&gt; I set up an offer in Mycelium app to sell 3 BTC. 

He already fucked it up at that point.

If you want money fast you don't need to do cash deals in Holland, there are much better alternatives."
2018-06-03,I upvote you cause it's TRUE. Bcashers still thinking their coin is bitcoin for some reason lmao.
2018-06-03,"**Bitcoin (BTC) Basic Info:** [Website](https://bitcoin.org) - r/Bitcoin - [Abstract](https://www.reddit.com/r/CryptoWikis/wiki/Bitcoin_basicinfo#wiki_short_description) - [History](https://www.reddit.com/r/CryptoWikis/wiki/Bitcoin_basicinfo#wiki_history) - [Exchanges](https://www.reddit.com/r/CryptoWikis/wiki/Bitcoin_basicinfo#wiki_exchanges) - [Wallets](https://www.reddit.com/r/CryptoWikis/wiki/Bitcoin_basicinfo#wiki_wallets) 

**Biases:** [Arguments For](https://www.reddit.com/r/CryptoWikis/wiki/Bitcoin_pros) &amp; [Arguments Against](https://www.reddit.com/r/CryptoWikis/wiki/Bitcoin_cons) | **CryptoWikis:** [Policy](https://www.reddit.com/r/CryptoCurrency/wiki/policy#wiki_cryptowikis_program_-_.28work_in_progress.29) - [Contribute Content](https://www.reddit.com/r/CryptoWikis/wiki/contributing)

---


*I am a bot, and this action was performed automatically. Please [contact the moderators of this subreddit](/message/compose/?to=/r/CryptoCurrency) if you have any questions or concerns.*"
2018-06-03,"My plan going forward a week, a month, who knows. I'm doing well in a shitcoin ATM. However once BTC nears 8200, I'm out and into tether, and likely for an extended period of time."
2018-06-03,"Lol resorting to baseless insults. There's a reason you never see shops price their items in btc. It makes no sense! 

"
2018-06-03,"since you are interested, the first thing that you should do is to search and learn everything about cryptocurrency.   In that way, you could develop a good app for crypto!..thanks for your interest and enjoy learning crypto!"
2018-06-03,"Because they censor and delete comments clearly related to Bitcoin developments the use of forks,etc. They are also hypocritical and talk about LTC openly but when BCH is brought up, users are banned.

If it's a serious question I suggest you look up censorship, but I doubt it is because it's pretty obvious they have banned tens of thousands of accounts for BS reasons by now."
2018-06-03,It is the natural pity of man to lift a brother when he sees that he has fallen. Crypto elists would describe this as upsetting social order.
2018-06-03,"Because they censor and delete comments clearly related to Bitcoin developments the use of forks,etc. They are also hypocritical and talk about LTC openly but when BCH is brought up, users are banned.

If it's a serious question I suggest you look up censorship, but I doubt it is because it's pretty obvious they have banned tens of thousands of accounts for BS reasons by now."
2018-06-03,Turning bullish again. We may pass 10k for bitcoin by month’s end.
2018-06-03,So this video basically proves that it is still very difficult to just use Bitcoin when you're travelling.
2018-06-03,"As the advertiser, you set the terms of the trade beforehand. Make very clear that the money gets counted and put away by you before the coins get sent. If they don't like it, tell them not to trade with you. You're the professional offering a service, they're the new stranger coming to buy Bitcoin. Also use localbitcoins since it has such a good reputation system. "
2018-06-03,"The simplest thing you can do - the passive thing :

Buy 0.1 BTC, convince everyone you know to do the same and then forget about it. Never check the price, ignore the news. One day, when you see it accepted by everyone every where, start using it to buy goods and services.

Less passive:

Refuse to budge, to do anything in the economy for and compensation that is NOT BTC.

Refuse to purchase any good or service for anything else other than BTC"
2018-06-03,Ironic that bitcoin get converted so quickly. It’s like having a garage sale during a fire. 
2018-06-03,"Half of these are Jihan's proxy pools, just like with Bitcoin but worse. 
Bitcoin.com, Antpool, ViaBTC, Coingeek can be considered one entity, and that's just from what we know for sure."
2018-06-03,"&gt;You failed to explain how removing the use case of bitcoin would increase its price. Its already used in dark net (actually its not, monero is the popular choice there) so its priced in, if they outlaw it only thing thats going to happen is merchant won't be accepting it people won't be able to buy or sell it with ease.

1. bitcoin is still the first choice on alot of markets, last time I visited alphabay in 2016, monero was second to btc.

&gt;No it didn't price crashed like 40%, than people realized it was just fud. Price increased because people realized it was lies, price didn't increase because china banned bitcoin. If the news weren't a lie it wouldn't recover.

I think you need to read up the definition of FUD, 
“FUD is a technique used by larger companies who have a large market share.”

Hence lies and FUD are one and the same. Thanks for going around in circles due to your superior understanding.

&gt;I wasn't complaining about the fee, I was complaining about them not using that fee, sending bitcoin with 1/sat byte and making it stuck in limbo for a day when mempool is empty, I don't know which one is more pathetic, you going through my post history or failing the understand a very simple point.

I don’t know which is more pathetic your investment strategy, or your arguing skills.

Going through your post history, just clarified what type of mindset you have."
2018-06-03,"Maybe by increasing the adoption of digital gold they will increase the tx fee, thereby make it harder to move and more gold\-like? Not only does Bitcoin simulate the limited supply of gold and it's method of production, it also simulates its weight! ... God, who knows what these people are thinking when they speak this rubbish. 

If a global financial crisis happened tomorrow, money would pour into precious metals, not Bitcoin. No question. No actual investor is going to think that a highly volatile asset like Bitcoin is going to be a safer store of value than gold and silver in such a scenario, and that is all that we should need to know to tank this absurd idea that Bitcoin can be ""digital gold"". The only way Bitcoin can possibly become a stable store of value is if it is adopted worldwide as a currency and used for everyday transactions. End of story. "
2018-06-03,"It's crazy. there are some very well educated people that I know and also in my family who know about Bitcoin,but have no intrest in it,but also the questions they ask and when given the best response I can muster still goes over their heads. We really are early. People look at the various valuations and that is not how we gauge where we are at. I don't know the best way to describe where we are at,but the comparison we are at the very early stage of the internet is probably the best comparison. We are early!"
2018-06-03,"Would it surprise you to learn that we have not been trained or educated on how to deal with declared crypto currency?

I mean, you could come in with a ledger, declare the value and hope you get an officer who knows what you have. I know a lot a lot of these older guys wouldn't know WTF you're talking about if you said you had digital currency. "
2018-06-03,I would search for a local bitcoin atm that does deposits and withdrawals.
2018-06-03,yes it is!...so happy that you are paying your vacation and goods in a cashless transactions but instead using a crypto!..amazing right?...how I wish I can do that too...
2018-06-03,"people are stupid and argue about BTC vs BCH. dont you think deeper that by forking bitcoin, now there is double the supply to mine - hence the miners will never let BCH fail. ideal scenario is where BTC and BCH are 1:1 value. that will maximise miner profits"
2018-06-03,"Because if you have any Bitcoin yourself you'd be helping yourself, silly."
2018-06-03,btctradefarm .com did well for me. I invested some bitcoins on their website and I got over 65% of my investment directly to my bitcoin wallet in less than a week. Thanks guys!
2018-06-03,"Of course. I agree. While ultimately regulators will not stop the crypto movement, they currently do have the ability to slow it down. So it is in everyone's best interest to educate them and help them make the best decisions possible, since that is the world we *currently* live in. Doing so can only help crypto adoption and innovation occur more quickly in the long term."
2018-06-03,"Sorry for your loss.  Are you saying that you were okay to exchange some USD20+k in cash from complete strangers?  

I have lots of questions but the main one is, why didn't you just sell them on an exchange?  Even if you were getting 10% premium on the market rate, surely you would count this as some sort of insurance premium? 

The next question would be that if you really had to do this, wouldn't you firstly do a ""trial"" amount like 0.5 BTC to test the waters, so to speak? "
2018-06-03,"Italy seems very friendly to crypto in general. There's also 120+ stores in Milan accepting Byteball (one of DAG-based currencies). 
https://byteball.org/milan/"
2018-06-03,How is Bitcoin Cash centralised? [https://cash.coin.dance/blocks/thisweek](https://cash.coin.dance/blocks/thisweek) 
2018-06-03,"I will use rhetoric to explain this. When you hodl BTC you are not earning. You are saving. Another aspect is if you have to keep an eye on it. Then you put in more than you are willing to risk. How often does a person look at their pension amount. Or their 401K amount. Not very often. And until you get comfortable with hodling btc it’s best to learn more about what the protocol has to offer. Even find friends and family who can research with you. Because it takes a team just to understand what is really going on. 

You can get a greater network effect to value by 100 million ppl all putting in $100 a month as saving vs trying to hit it big with a large one time exchange. And the market will become less volitile because savers will always have a floor set. "
