Date,text
2018-06-03,"&gt;  The sense in which Satoshi referred to them together is not really relevant to this discussion.

It is.

&gt;They vote with their CPU power, expressing their acceptance of valid blocks by working on extending them and rejecting invalid blocks by refusing to work on them.

&gt;https://nakamotoinstitute.org/bitcoin/#selection-2129.877-2129.1039

They only way to ""accept"" a block is to mine on top of it, and the only way to ""reject"" a block is to refuse to work on it."
2018-06-03,"Mike Hearn's article on [Merge Avoidance](https://medium.com/@octskyward/merge-avoidance-7f95a386692f) covers this exact topic. 

It is really too bad that the Core minions succeeded in driving away such a bright mind from the Bitcoin project."
2018-06-03,"Two posts were removed from cc yesterday about Waltonchain attending the Great hall of the people in Beijing, for those that missed them; they spoke about blockchain in front of government officials. Its unprecedented that a crypto being welcomed into such a big political forum in China before. And this right after China president saying blockchain is the future. Hopefully this opens some eyes here on cc and the rest of the crypto communities about how big Walton will be with its platform in the coming years. How anyone is still calling it a scam is beyond me, and they are either heavily misinformed or just listening to fud from people with ulterior motives.
https://medium.com/@Waltonchain_EN/waltonchain-invited-to-china-blockchain-technology-innovation-and-development-forum-2e7fb8c05da0"
2018-06-03,I'm thinking of a lonely old man desperately trying to figure out how to buy Bitcoin to save his dignity.
2018-06-03,Possible spam by LN developers to ruin our Bitcoin 
2018-06-03,"&gt; If BTC had been a place where innovation was possible, it would have maintained its market dominance.

speculation. would you claim the same about yahoo or microsoft during the dotcom bubble? why were there millions of shit.com projects if yahoo and microsoft were all about innovation?

alternative sprawl is inevitable until reality kicks in and people realize that 99% of those alternatives are shit scams.

&gt; The BTC team capped blocksize

Satoshi capped blocksize. Bitcoin Core team (and majority of bitcoin network of miners, users, merchants and vendors) resisted contentious hardfork proving that expanding the blocksize is not the best strategy to scale on chain capacity.

&gt; I'm not sure how you think it does

of course everything depends on your definition of efficient use of blockchain. segwit enables more transactions to be fit in single block by separating the witness data out of it. keeping witness data part of transaction data structure is inefficient because you could with the same effect only have a reference to witness data instead.

this helps capacity, this helps UTXO size, it is more efficient use of block space.

&gt; something like Nano is better

snake oil

&gt; it's easier to move to altcoins than to use LN

sure, go for it. i feel very much safer having a secure and stable ground under my transaction platform so i'll stick to LN.

&gt; When a transaction is submitted and a fee is paid, the miners are being paid to store that information. Anything that pays the price is valid.

yes, that applies to BTC too. it stops working when your project's jesus decides that price must never be more than a penny.

&gt; What is your priority for a cryptocurrency?

decentralization, don't trust - verify, censorship resistance, network stability. all of these imply we can't let cost of running full node grow out of reach for commodity hardware.

""third world countries"" is a strawman argument. for any meaningful transaction fee there will be somebody in the world for whom it is unacceptable, so the only possible acceptable fee is zero. don't like to use argument from authority fallacy, but since you're so much into satoshi's true vision - they recognized in a whitepaper that fee-less system is unsustainable. if you're fine replacing fees with inflation, giving miners the precedent to contemplate increasing inflation in future (because poor us, there are no fees but so many transactions, we need more moneys) - good luck with that.

&gt; We have had ""free cheese"" for the past 6 or 7 years before the blocksize limit was held at 1mb. Lets remember that 1mb was an arbitrary number decided years ago when computers were much less powerful. We can now easily run 32mb blocks on a home computer.

we probably can. but we have not yet explored all possible ways to increase on chain scaling without resorting to blocksize limit increasing hardfork. for some people being smart about how blockspace is used is much more important than having more blockspace. i'm one of them. there are many of us. because of us such hardfork will always be contentious."
2018-06-03,"**we have to ask ourselves whether there is more to all the crypto scams, fake ico's and crypto ransom stories.** 

This goes way deeper than the old scaling debate... I think he might be onto something"
2018-06-03,You mean bitcoin cashers. @Bitcoin is not a pro-bitcoin twitter. It’s meant to provide anti-bitcoin propaganda and that is why Andreas blocked it. 
2018-06-03,"u/Shiba_Inu_ni_Naritai, you've received `0.0001 BCH ($0.112904 USD)`!
***
[^^How to use](https://np.reddit.com/r/tippr/wiki/index) ^^| [^^What is Bitcoin Cash?](https://learnbitcoin.cash/) ^^| [^^Who accepts it?](https://acceptbitcoin.cash) ^^| ^^r/tippr  
^(Bitcoin Cash is what Bitcoin should be. Ask about it on r/btc)"
2018-06-03,"Jokes on you. The 3 BTC were his trial amount.

After that he would have offered 3000 BTC."
2018-06-03,"Essentially how I built up my crypto investments: accrued currency via Acorns round-ups, transferred the fiat into crypto.  

No withdrawal fees from Acorns *casts dirty look at crypto exchanges*"
2018-06-03,"Not to worry, they won't do it until they have their own proprietary off-chain scaling stuff in operation. A BTC that doesn't need second layer is not in their short term economic interest. Blockstream has been given tens of millions to develop side channels, it's literally their business model, and they control the repository utterly. 

BTC won't see larger blocks for years at this rate, the LN is still a buggy pre-alpha with huge issues, and it's going to take a long while to get this stuff off the ground - and if sensible minds prevail, it never will take off, because it's unworkable garbage, that even if it would take off would just ultra-centralize BTC and give bankers total insight. 

So it doesn't matter how much people goad Blockstream. They'll never increase the block size at this time. They will probably go to 2MB if and when LN is a success, no sooner."
2018-06-03,"And Segwit LN needs to stop pretending it is Bitcoin, it is not and has none of the decentralization and immutable ledger benefits."
2018-06-03,"Yeah, well maybe its bot upvoted like crazy, but honestly this is sometehing that needs to be talked about. This brings revolution to digital age. I mean trinary based computing. Jesus. This project is the most epic in the whole crypto and I say that as a big supporter of at least a dozen of other projects. Im surprised the proce didnt move that much, guess iota really is immune to the news effect. Well never mind, point is, this is future."
2018-06-03,"Yes! Lets celebrate and talk about all the good stuff going on with Bitcoin Cash, there is so much now I cant even keep up"
2018-06-03,"&gt;If you should arguably know the outcome, and by knowing the outcome it diminishes the utility Why is it so arguable?

I would say you should know the output or you risk spamming your peers with invalid (i.e. computes to False) transactions.

&gt; Unknown conditional outcomes using Bitcoin script are possible and that also has a utility. It depends on the use case.

What use case benefits from sending transactions which you don't already know compute to True? It's a good way to get your peers to disconnect you. What else would that accomplish? You can't even confidently detect when a transaction has computed to false as invalid transactions are neither relayed nor included in blocks.

&gt;Thats just your idea.

No, it is a consequence of Bitcoin's limited computational abilities. That limitation is not a shortcoming, it is an intentional design decision. You could change BCH to enable Turing-complete computation, but that would be something new.
"
2018-06-03,"It's time to buy Bitcoin, like every time every day, why you ask?"
2018-06-03,"&gt; My phone does not know the state of everyone on the network,

Then you're not using Bitcoin, just blindly trusting someone else who does."
2018-06-03,"""I provide you my Btc number - 1CUM...."""
2018-06-03,"Yeah, so Bitcoin before 2017 wasn't the real Bitcoin either, I learn so much from you every day!"
2018-06-03,Bitcoin has nothing to do with Tiananman square and this is stupid. Please r/bitcoin don’t become r/conspiracy. 
2018-06-03,"&gt; And these are not Bitcoin IOUs. These are signed Bitcoin transactions from real private keys with real Bitcoin. The transaction is signed but not broadcast and is simply past on to someone else to broadcast if they want to.

What are these signed transactions worth if your node is offline long enough for someone to broadcast an old state? I understand that there are defences for this, but if it were real Bitcoins then this attack would not be possible.

LN transactions are IOUs just like bank checks. I can exchange a bank check for a real dollar, just like you can exchange a LN transaction for a real Bitcoin, but until the exchange is made there is little difference between the two."
2018-06-03,"Why the /s? Original release of bitcoin client was far far advanced and had been well considered likely for years.

You're being an idiot talking about LN here tho, when the topic is bitpay is forcing a terrible BIP down users throats."
2018-06-03,"Bitcointologist: Jihan is the enemy of Bitcoin

Jihan: thanks for giving mee between 0.25 - 1% on every tx you make! I love small blocks now, I am getting rich on tx fees. 

Jihan is getting paid by his haters ... let that sink in ... "
2018-06-03,Found that these txs are clearing to this address \- [https://www.blocktrail.com/BTC/address/3CswTd6V8V2uv24P9yWHpPnFiLfN4CABgW/links](https://www.blocktrail.com/BTC/address/3CswTd6V8V2uv24P9yWHpPnFiLfN4CABgW/links)
2018-06-03,"My phone does not know the state of everyone on the network, yet I am able to send BTC and BCH just fine. One is a bit cheaper then the other though"
2018-06-03,Its too late. Well done Deadalnix for forking Bitcoin!
2018-06-03,"Nah, give him another month or two. 

When I look at him, I think ""he's another one of these guys who seems smart enough to figure it out, but it will take him a few months of research to un\-learn the propaganda he's been fed""... The funny thing about coders is that they think they are ""too smart to be influenced by propaganda"". Ironically they're the first to fall for appeals to authority \(Core devs as the absolute center of the crypto knowledge universe\) and overly technical solutions to simple problems \(Segwit, LN, RBF\). 

But the ""digital gold"" meme is just too stupid for anyone with a semblance of critical thinking skills. "
2018-06-03,"Crypto bulls congesting the network, noooooo..."
2018-06-03,"&gt; Ok. Looks like your just mudding the waters even more, but whatever.

Not really, I am trying to clear things up. Real world does not always fit into a perfect mold. 

&gt; Script is very limited in what it can compute, no matter how many transactions you split it across. In particular, Script always results in a binary True/False output - and only True outputs actually get recorded. Furthermore, you can (and arguably should) already know the result of a transaction broadcast to the network, greatly minimizing its utility as a means for computation.

Wait what? If you should arguably know the outcome, and by knowing the outcome it diminishes the utility Why is it so arguable? Unknown conditional outcomes using Bitcoin script are possible and that also has a utility. It depends on the use case. 

&gt; While more complex, multi-transaction behaviors are possible, the majority of meaningful computation would be handled by external components, not Bitcoin.

Thats just your idea. This is the same sort of rhetoric that caused Vitalik to create ethereum to begin with."
2018-06-03,"Quark Chain, the worst name ever created for a crypto currency."
2018-06-03,"I don't know why you guys keep mentioning this Andreas in this forum! The guy has been bought with $1M+ by Core supporters even if Jesus Christ himself says BCH is better than BTC Andreas would deny it, The guy will support the opinion of the higher bidder period, his academic background doesn't mean shit even if it means BCH has the right appraoch.     "
2018-06-03,"he blocked me after I said ""bch exists because bitcoin was taken over by frauds"", I guess he doesn't read replies too carefully when looking to block shills and spammers.
"
2018-06-03,How does it change who has more wealth. Sure you probably get gains if crypto grows bigger but in the end there are still people with more wealth.
2018-06-03,He would promote the shit out of crypto
2018-06-03,Lol crypto doesn't help if you face the military. This is stupid.
2018-06-03,"Crypto is a very flashy space with a lot of bs both in terms of what ppl/companies claim as well as what they do. So I have little expectations about anything I find here - just as a means of ""protection"".

I don't have any reason to believe you guys have bad intentions or anything. So please don't take this as an insult. I just don't give stuff in crypto the benefit of the doubt.

Was thinking if the app mainly does ui, talking to the backend and some caching there's little business risk in open-sourcing it. But it opens up a great portal for bug reports and ppl pointing out problems with the app cose. My assumptions may be wrong though."
2018-06-03,"This has what exactly to do with Crypto? Cryto-NeoLiberal Nationalist loons maybe but wrong sub buddy. 

They're paying you too much. You're not good at your job. "
2018-06-03,https://lists.linuxfoundation.org/pipermail/bitcoin-dev/2017-December/015455.html
2018-06-03,"During previous transaction backlogs people have tended to claim that it’s all just a spam attack from people trying to undermine Bitcoin. In this case that is probably correct.

If you look in detail at the ‘set of plots OP keeps linking](https://jochen-hoenicke.de/queue) you can see that the current 40MB backlog only consists of about 4,000 transactions. Ordinarily a 1MB block can clear between 1,000-2,000 transactions. So what’s filling the mempool right now is a few thousand weirdly large transactions.

You can also see that about 80% of the transactions are currently paying 1 Satoshi per byte, so someone has submitted thousands of weirdly large transactions with the smallest possible fee.

Now, anyone who wants to send a normal transaction needs to outbid this wall of 1-Satoshi data, and a lot of wallets are notoriously bad at overestimating the fees necessary. So if the backlog doesn’t clear it’s likely we will see high fees on BTC pretty soon."
2018-06-03,crypto is such a dick tease
2018-06-03,"&gt; we can have blocks large enough so that the whole world can use them

you're making claims. you're not backing them up by anything. i know how exciting it can be to think of bitcoin handling all world's transaction volume, but at some point you have to come down to earth and do some number crunching.

gigablock, terablock, exablock - i don't give a shit about catchy names. until either of these snake oil projects manages to handle substantial traffic for a year - it will remain snake oil. and you better grow some skepticism skills if you don't want to be the last guy holding the bag."
2018-06-03,"&gt; any source for this?

https://www.google.de/search?q=bitcoin+twitter+banned

take your pick"
2018-06-03,"
Blocking Bitcoiners isn't going to help Bitcoin. "
2018-06-03,"Nothing to do with Bitcoin  
These are cash deposit ATMs  

&gt; how can these banks “forget”

Large corporations are incompetent bureaucracies  
Hundreds of bank employees and managers knew the ATMs needed to have AML implemented. They wrote memos and added the task to their to-do lists, sent more memos asking permission to fund the work and hire staff. Five years later the work was still not done"
2018-06-03,"it absolutely does. People listen to him, see him as a authority figure, he wrote critically acclaimed books and was a spokesperson for the bitcoin community for a long time. Yet for all his knowledge, he pretends as if the scaling debate is of no concern and that BTC is still the same old BTC he used to promote years ago even though its basic functionality (PEER-TO-PEER ELECTRONIC CASH) is almost gone.

His failure to address this issue is intellectually dishonest and hypocritical and we have to call him out on that"
2018-06-03,It's Bitcoin Time
2018-06-03,Welcome to crypto...
2018-06-03,"Sure I could. The process would be very similar to that in the above post, only that the incentives given by PoW in combination with the protocol rules would tend to discourage it better. As you can see in my example, I chose to make it difficult for myself so that once the second layer was able to print money so were the Bitcoin nodes (meaning solo-miners and pools)."
2018-06-03,"From the Bitcoin whitepaper:

""Commerce on the Internet has come to rely almost exclusively on financial institutions serving as
trusted third parties to process electronic payments...

What is needed is an electronic payment system based on cryptographic proof instead of trust,
allowing any two willing parties to transact directly with each other without the need for a trusted
third party.""

Crypto isn't anti-banks, it's a replacement."
2018-06-03,These guys really think adoption is starting a Bitcoin hobby. You must each get your raspberry pi and a waterproof case for it and become a full node sysop. Alice and Jane are checking their UTXO sets. It's totally the future.
2018-06-03,BitPay doesn’t let me send to a bitcoin address. Fuck them and fuck you too 
2018-06-03,"Seems like people are spamming the btc mempool again with small transactions. They don't like that btc transaction fees were the lowest it had been in many years

https://www.reddit.com/r/Bitcoin/comments/8of1ih/block_525878_someone_is_clearing_thousands_of"
2018-06-03,"&gt; Right, but you won't know that's happening unless you're running a node (I'm assuming we agree that we need to avoid trusting others).

You are not required to trust anyone, you of course trust the incentives mechanism of bitcoin otherwise you wouldn't have any coins or use it in the first place.

&gt; But doing that means sacrificing trustlessness.

More or less, I'd say no if there are enough enough competing explorers around. Ultimately, you can just listen to blocks yourself.

The only reason to have the full blockchain is if you want to control very old UTXOs. Say someone wants to spend an UTXO from 2013 for 100x the actual amount. Everyone (other) competing miner has a big incentive to reject that in a block because this will make the block invalid and they will publish their block instead.

No miner has incentive to mine it because they will waste money.

Again, your trust is a trust in a system of incentives.

It is true that Jihan or bitmain could physically, practically, try to cheat like that, but it would be blatant and they would be screwed.

&gt; It seemed clear to me that the original tweet wasn't trying to say ""miners don't validate your transactions - you validate your transactions"", but rather ""miners don't validate your transactions, you validate the transactions in their blocks"".

It is still wrong.

As for the rest, I think we are in agreement."
2018-06-03,"If you never close your channel, then the BTC chain is irrelevant, LN becomes a network of its own, separate from the blockchain.

When at a certain time, only a small portion of channels can be closed because of the blocksize limit, then it becomes a de facto fractional reserve banking because many people can not redeem their BTC at the same time, and if they tried, it would be akin to a bank run - exactly the system we have now.

Then they'll argue that in order to prevent this risk, BTC backing should be removed all together, LN works without it great anyway. Removing the BTC backing then becomes just a technical issue to be solved and they do have the *best devs* to accomplish anything, do they not?"
2018-06-03,"&gt; Segwit 2x means the block size can already increase

the whole NO2X campaign proved conclusively that the whole BTC community has no interest in scaling on-chain anymore"
2018-06-03,"But how can these banks “forget”. They think they are above the law, and a hypocrites when constantly linking bitcoin to criminal behaviour. "
2018-06-03,Then why the fuck would I need Bitcoin if Nano does more
2018-06-03,"It creates a backlog and slows down the network, which causes newbs to think btc is broken ~ panic selling."
2018-06-03,"""Binance will open trading for QKC/BTC and QKC/ETH trading pairs at 2018/06/04 09:00 AM (UTC). Users can now start depositing QKC in preparation for trading."""
2018-06-03,"&gt; they need to know what chain they are buying and transacting on.

BTC and BCH are the two non-ambiguous names that offend no one and describe exactly which chain is meant

&gt;  ethically you should not steal the brand of something

ethically people should not have their internet DDOS'ed, their characters assassinated and their voices forcibly muted just because they want BTC to be able to grow. You do not want to start thinking about which side of the debate here is ethically just or you're going to risk having an aneurysm when you discover all the shit Core and their friends have pulled"
2018-06-03,Yes! We were going to add charts next. Hope it can be your main crypto website
2018-06-03,"Actually there could be an argument for that case..

In 2015 the Economist did suggest control of Bitcoin Blockchain with their [cover page graphic showing a coin with the Bitcoin logo *plus* a pyramid *plus* an all seeing eye *plus* the expression ""In Blockchain We Trust""](https://mobile.twitter.com/theeconomist/status/659718867070119940)

It could be argued that those ""all seeing powers"" did subvert Bitcoin BTC via Blockstream but it could also be argued that Bitcoin BCH is the original blockchain, since The National Institute of Standards and Technology from the United States Department of Commerce has stated in a high level overview of blockchain technology and cryptocurrencies that [“Bitcoin Cash is the original blockchain""](https://www.trustnodes.com/2018/01/29/bitcoin-cash-real-bitcoin-says-us-government-department)"
2018-06-03,"I love how I answered your question with a fact you can easily google and got downvoted to hell just because ""this isnt good for bitcoin"". "
2018-06-03,"&gt; I changed my original post to meet a stricter definition. If a tape can be fed into the Bitcoin system, people will just do that. 

Ok. Looks like your just mudding the waters even more, but whatever.

&gt; In this case the second half of the tape is offchain.

It's not the tape that exists outside of Bitcoin, it's the functionality of the  read/write head and the symbol interpretation. These are the more interesting components - especially the interpreter, as this is where Script falls short of Turing-completeness.

&gt; I wouldnt discount the usability of splitting computation across multiple transactions just yet.

Script is _very_ limited in what it can compute, no matter how many transactions you split it across. In particular, Script _always_ results in a binary True/False output - and only True outputs actually get recorded. Furthermore, you can (and arguably should) already know the result of a transaction broadcast to the network, greatly minimizing its utility as a means for computation.

Unlocking and reassigning funds _is_ an interesting ability and use case for the blockchain. Script's limited computational ability is sufficient for that case. While more complex, multi-transaction behaviors are possible, the majority of meaningful computation would be handled by external components, not Bitcoin."
